,Unnamed: 0,댓글
2111,2111,"그렇게   좋은  약을  판매를  않하는이유가  이이금이 적은탓  같네요듣고보니  꼭  다시  판매되도록수고해 주세요  ,,,"
2112,2112,예전에 두통이나 감기에걸리면 아스피린이필수엿는데 근데 (간)에는치명적입니다 조심하세요
2113,2113,아스피린의 효능은 잘알지만...개인적으로 아스피린 알러지가 있어서 못먹는다는.....
2114,2114,제가 콜레스테롤 수치도 약간높은편(약먹을정도는아님)간수치도 조금 높아요(역시 약먹을수준은아님) 암가족력있음20년째흡연자입니다 그래서 이영상을보고  조금이라도 예방이된다면 아스피린을 복용하고싶어요약국에갔더니 아스피린100mg(30알에천원)가있고 아스피린프로텍트100mg(98알에8천원)가있는데 약사분이 매일먹을꺼면두개가 다른거라고 프로텍스를 먹으라는데 맞는건가요?
2115,2115,프로텍트나 아스트릭스 드시면 됩니다 그러나 님의 경우 후속영상에서 제시한 심장병 10년내 발생률 10% 이상인지 확인이 필요합니다 단순 암가족력이나 콜레스테롤 조금 높은 정도로 권할수 없습니다
2116,2116,저는 심한 위장장애에심한 이명으로 곤혹을 치렸어요직접먹어보고 말하세요한 분은관절치료로  장복해서 위암수술했어요부작용 심합니다
2117,2117,사우디에서 아스피린 100mg 사서 묵고 있어유~~감사합니다
2118,2118,수고하셨읍니다
2119,2119,지금 말씀 하시는 건  프로택트100를 말씀 하시는지요~~근데 병원에선 다른 약을 줘요우리가 감기 올 때 먹는 아스피린도 괜찬은 가요?
2120,2120,특허 풀려 동일성분이면 다른 제약회사 아스피린도 좋습니다 진통소염 목적 500밀리가 최근 판매재개됐습니다
2121,2121,"홍혜걸 의사선생님께서 만 50세 - 만 59세이신 분들을 특히 강조하시는데, 만 50세 이상이신 분들에게는 효과가 있다는건가요..? 혹시 만 50세에서 만 59세까지만 먹어야 한다는 말은 아니겠쬬...??"
2122,2122,50-59세가 가장 이익이 커서 권장할만하다는 뜻입니다 다른 연령층도 의사 판단아래 부작용 대비 이익 크다면 개인적으로 시도할 수 있습니다
2123,2123,그렇죠. 왜 안파나 했어요빨리 먹어야 겠는데  어디가서 사요. 나 지금 먹어야 하는되.ㅜ.ㅜ박사님  항상 응원 보냅니당!
2124,2124,민들레 홀씨  베샹 세포론 검색 브리검 여성병원 조사 아스파린 주 14 알복용시 쵀장암 86 프로 발생ㅡㅡ네추럴 뉴스ㅡ 김국일작가 아스피린   검색
2125,2125,우리나라는  지식이나모든면에서  아직도후진성에서 못  벗어나고있죠
2126,2126,일반적으로 머리 아플때나 배가 아플때는100mg 약을 먹나요? 500mg 약을 먹나요?
2127,2127,"진통,소염 효과로는 500mg을 드셔야합니다. 배가 아플 때는 아스피린의 부작용도 있기 때문에 정확한 원인을 의사와 상의해 파악 후 어떤 약을 드실지 정하셔야합니다."
2128,2128,따르고싶지만 시골 대학병원 에  의사는 처방을 안해주네요? 뇌출혈 수술후 집에서 쉬는54세의 남자입니다.
2129,2129,국민의 생명보다 사리사욕에 쩌는 자기만의 이익을 쫓는 이익집단들의 행동때문이죠이것또한 폐단이라 법으로 통제해야합니다
2130,2130,"안녕하세요. 저는 캐나다 유학시절 아스피린 포장이 알사탕처럼 이뻐서 구입을 하였습니다. 그러다 한알을 먹어보고 싶은 생각에 나는 지금 머리가 아퍼라고 혼자 자기 암시를 가지고 아스피린 한알을 복용하였는데, 복용후 온몸이 뜨거워 지면서 한 30분 정도 누워 있어야만 했습니다. 그 다음 한국에 돌아와서 감기가 들어서 병원에 가서 얻은 처방전으로 약을 복용했더니 온몸에 두드러기가 발생하여 병원 가서 긴급처방으로 주사를 맞아야 했습니다. 그 다음부터 저는 감기가 들면 아스피린에 관련된 약을 복용할 수 없게 되었습니다. 이 글을 남기는 이유는 어그로를 끌려고 하는게 아니라 이런 부작용도 있다느 거를 알려드리고 싶어서 글을 씁니다. 좋은 정보 항상 감사합니다."
2131,2131,"그럼 왜 아스피린이 인기냐하면개인적으로 아스피린의 진통,소염,해열 효과보다항응고제 작용 및  요즘 밝혀지고 있는 단백질과의 결합 능력 때문이라고 생각합니다.비아그라가 처음에는 심장병약이었다가 발기부전제로 쓰였듯이 새로운 작용이 밝혀지면서 특허가 풀린 저렴한 가격의 약에 대한 과학자들의 호기심이 작용한 것이라 판단됩니다.터무니 없는 약값 아스피린 100mg 와 비슷한 효능을 가진 항응고제가  10배 ,100배의 가격이니 아스피린이 가지는 유혹은 달콤하죠거기다가  해열제및 진통제로는 해열제로서는 아이들에게 레이증후군을 일으켜서 효용성을 잃어버리고 진통제로서는 위장장애 및 알러지 증상이 나타나는 빈도가 타 진통제에 비해 높고 그렇다고 진통제의 효능이    부루펜이나 cox 억제제에 비해  떨어지니 메리트가 없던 차에 아주 좋은 단백결합능력으로 암이나 기타 장기에 붙어서 다른 효능을 나타내는 역활을 하니 연구해 볼 가치가 높아 졌을 뿐 입니다.아직도 가야할 길은 많다고 생각합니다."
2132,2132,아스피린 100mg 꼭 먹어야겠네요
2133,2133,동양인은 아스피린등 피린계 부작용이 있는 사람이 의외로 많아요!!! 생명을 앗아 갈 수도 있지요!!!
2134,2134,저는 천식환자라... 피린계 약을 먹으면 천식이 올라옵니다... ㅠ
2135,2135,생명을 앗아갈때까지 먹는 사람이 바보아니에요...?
2136,2136,아하~이스피린이 만병통치네요근데 저는혈압약에 아스피린한알을 5년정도 먹었는데 코피를2년이나 쏫고살았어요코피가 지혈이 안되어서119타고 종합병원가는데소방대원이 혹시 아스피린드시느냐고 하시대요왜드시는지 담당의사한테물어보고 끈으라고 하기에의사한테 얘기해보니 끈어보라고 해서 끈었더니그후로 코피안나요잘 알고 드셔야해요이렇게 좋은약이 저는왜 안맞을까요??좋은정보 감사합니다
2137,2137,저 어릴적엔 약국에서 쉽게 팔았어요 엄청싸고
2138,2138,"친중매국노 전라도 김대중세력이 의약분업을 이용해서 일반인이 좋은약을 약국애서 서기 힘들게 먹아 놓은것임 물론 언론계는 약품남용을 막기 위해서라고 쉴드쳐주고 웃긴것은 김대중 의약분업 이후 치매 , 당뇨병, 암환자가 폭발적으로 증가했고 병원에 의한 약품판내가 폭발적으로 증가했음 유투브검색 “”””충시민 “”””진실의 목소리"
2139,2139,젤 좋아하는 노래 제목이기도 해요.. 걸의 아스피린
2140,2140,아스피린 고딩때 700페이지 넘는 책읽었는데... 10년전인데 그때도 좋다고 나왔지 ㅋㅋㅋㅋ 인간이 만든 최고의약 뭐 이런말적혀있었는데
2141,2141,그럼 아스피린이 신장에도 좋은지요?
2142,2142,신장에 좋은지는 확인되지 않았습니다. 신장에 좋은건 베이킹소다가 좋은걸로 알려져 있죠. 만성신부전증 환자에게 약으로 처방하는게 베이킹소다입니다.
2143,2143,브루스 윌리스 형이 아스피린만 찾던 이유가 있었네 ㅎㅎ
2144,2144,안녕하세요. 비온뒤의 김용태  PD입니다. 유명인사중에서 아스피린을 규칙적으로 복용하시는 분들이 계십니다.
2145,2145,ㅋㅋㅋㅋㅋㅋㅋㅋㅋ
2146,2146,50살부터 먹어서  70살까지 20년 먹으면 70살부터 먹는거 조심해야 한다부작용 생각해야 한다   그러면 70살부터는 무엇을 먹나요
2147,2147,아스피린 먹고 국민들이 건강해지면 안 되지 때문입니다.한국은 인구수 감축 + 제약사들이 돈 벌어야 하는 곳임.근데 아스피린 먹고 건강하면 장사도 안 되고 인구도 빨리 안 줄어듬.
2148,2148,아스피린 함부로 드시지 마세요...위험합니다
2149,2149,50대~60대 먹어라.아스피린. 심장병 암예방 염증 예방. 감사드립니다.
2150,2150,예전에 오프라 윈프리 쇼에서 성인 누구나 어린이 아스피린 2알씩 매일 복용하라는 말을한 의사가 있었고 엄청난 유행을 낳았죠~ 지금도 드실분은 어린이 아스피린 2정을 하루에 한번 드시면 되여~ 당시엔 난리 났었어여 혹시 아시는 분은 아실텐데 ^^ 오프라 윈프리도 맬 먹는다네여 ㅋㅋ
2151,2151,참~! 부작용 없는 사람 드셔야 되여 ^^ 병원가서 확인하심 피린계에 부작용이나 알러지 반응 있는지 없는지 알수 있어여... 저는 천식환자라... 알러지 반응이 있어서 천식 올라와여 ㅠ ㅠ 매일 드실분은 꼭 확인하시고 드세용~
2152,2152,저 그 방송 봤었어요캬~  그 방송이 벌써 20년은 된 듯 하네요
2153,2153,어쩐지 타이레놀만 즐비하더라니요. 로비가 장난아닌가봐요.
2154,2154,"다좋은데 통풍 유발인자임 조심히드시길 저또한 아스피린 좋타고 하여 3일먹엇는디 통풍와서 죽다살아남,아마도 요산수치 높은 상태에서 섭취하면 부작용이 생기는듯함 통풍발작후 어느정도 진정 돼엇을때 (2~3일경과) 피검사 해보니 요산수치 9엿음 참고하세요."
2155,2155,어쩐지 타이레놀만 즐비하더라니요. 로비가 장난아닌가봐요.
2156,2156,타이레놀은 원인 제거는 안 되는 거로군요?
2157,2157,저혈압 인 사람이 아스피린을 먹으면 부작용이 일어납니다. 내가 저혈압이데 베비아스피린이 좋다고들 하기에 임의로 계속 먹었는데 몸에 이상이 오는것을 느껴 의사한테 물어보니까 저혈압 인 사람은 아스피린 먹으면 안된다고 했습니다. 미국에 삽니다
2158,2158,맞아요.  저도 저혈압인데 너무 몸이 안좋아서 중단했어요.
2159,2159,제가 저혈압인데 6개월째 매일 1알씩(81mg) 복용 중입니다.  아스피린을 1통에 1년분 양이 들어있는 것을 선물로 받았거든요.제가 건강진단을 받은 결과가 '고지혈증 주의'라고 나왔고 '다리에 쥐가 잘 난다'라고 말씀드리니 지인분께서 고맙게도 자신이 먹으려고 했던 것을 저에게 주셨어요.저혈압을 가진 사람이 아스피린을 계속 먹으면 부작용이란게 어떤 증상인거죠?피가 묽어져서 지혈이 안될 수도 있다는 얘기는 들었지만 제 경우엔 다쳐서 상처가 나도 피가 묽어진 느낌은 안 들어요.그 외엔 어떤 증상이 생기는가요? 몸에 어떤 이상증세가 온건가요?
2160,2160, @Gold Moon  쥐가 잘나시는거 마그네슘 부족일 수 있습니다 제가 고생을 많이 해서 지나다 글 남겨봅니다 위경련까지  겪고 나서 원인을 알았는데 ㅜ 위경련 출산고통에 1만배는 아프요 숨도 안 쉬어지구요 꼭 한번 마그네슘부족이 아닌지 알아보시고 건강하게 지내세요
2161,2161,좋은정보 감사합니다 비타민1000mg을 하루세번 먹고있는데 아스피린100mg을 매일먹어도 됩니까 답변주시면 감사하겠습니다 항상 건강하세요^*^
2162,2162,마진이 안남아서 그렇다면 100원 짜리 천원이라고 해도 팔아아죠.
2163,2163,아스피린 팔던데요  제가 사는건 다른 건가요?
2164,2164,Weight-Based Aspirin Dosing에 대한 설명이 좀 부족해서 아쉬웠어요. 저는 90키로 이상이라 325MG 복용하는데relevant M.d. Journal에 따르면 weigh 50-60Kg은 81Mg 이하 70KG 이상은 325MG effective 하다 하여. 325MG 복용합니다.
2165,2165,아스피린좀 팔아주세요~ 타이레놀처럼 사고싶습니다.
2166,2166,나는 관절염 환자들에게 아스피린을 권한다. 위장 장애가 두려우면 아스피린에 sugar coating 한 Ecotrine을 복용하면 된다.
2167,2167,그럼 아스피린 이젠 못 먹는 거야? 아플 때 그냥 먹으면 좀 편해지던데...
2168,2168,1년 동안 저용량 복용 중혈압 안정화 되고부정맥 없어지고부종이 없음
2169,2169,어떤 제품을 어떤식으로 복용하셨는지 구체적으로 알수 있을까요?
2170,2170,부정맥으로몇년동안고생하고  있습니다어떻게  먹어야효과가  있는지?  알려주시면  감사하겠습니다
2171,2171,50-100mm 아스피린을 식사후 꾸준히 드시면 됩니다.
2172,2172,아스피린을 3일 연속 먹었는데 위장에이상한 현상이일어나서 1주일에한번먹어요..ㅜㅜ
2173,2173,"웃기는건 미국 엘레이에서도 아스피린 찾으면 타이레놀 먹어야 된다고 막 그래서, 왜그러냐?  아스피린 달라고하자  아스피린은 머그면 안되고 타이래놀 먹어야한다고 막 우기더라고요, 순간 강하게 느낀게, ""야! 엄청난 로비가 있구나"" 였습니다, 더 솔직히 고백하면, ""사람들이 병나야 돈버는 인간들의 엄청난 로비가 있구나"" 였습니다"
2174,2174,ㅇㅇ 장사꾼들은 사람을 사람으로 안봄 상품이나 쓰레기 둘중 하나
2175,2175,헤휴 ....왜 그럴까요??? 로비? 혹시 이사람이 돌팔이라고는 안생각해봤씁? 정 원하시면 왜 에스프린이 81mg 빼고 325 500mg이 왜 안쓰이는지?? 유튭에서 돌팔이가 말하는데로 믿지좀 맙시다. 원하시면 제가 왜 이사람이 돌발이인지 논몬 써드리져.
2176,2176,근대 요즘 500mg 먹어봤는데 위 빵구났어요 ~
2177,2177,KM Oh 네 논문 부탁드려요.
2178,2178, @AAA  그쪽은 돌팔이 축에나 끼워주나요 남을 비판하는 글을 쓰실땐 이유를 대세요
2179,2179,km oh/아직 논문 준비중인가요?
2180,2180,"타이레놀은 미국회사, 바이엘은 독일회사니까요."
2181,2181, @AAA  서울대나온분인데...
2182,2182,KM Oh 원합니다!
2183,2183, @大신라혼  ㅈ
2184,2184,기업은 이익을 위해 존재한다. 제약사는 절대 국민의 건강을 가지고 이익을 얻는 기업이지 절대 봉사 하는 단체는 아니다. 아스피린? 몇몇국가는 찾기도 힘들다. 그것은 곳 국민을 위한 국가가 아니라 기업의 로비로 기업을 위해서 국가가 존재 하는 구조 또한 국민의 우매함이 나오는 결과이다. 한국 처럼!!
2185,2185,(대장암을 만이떨어뜨린다네요)이렇게 설명하심 안되져닥터께서  어디서 들은얘기전해주는 식으로 그쵸??어찌됐던 좋은정보 감사합니다저도 2ㅡ3년복용하다손톱끝에 피가  잘  멎지않는거같아 처방에서빼버렸지요
2186,2186,의학이나 약이 순수하게 생명 살리는 일이라는 긴 매우 유치하죠. 진실도 아니고. 생명 살ㄹ는 돈벌이입니다. 둘 모두를 충족하지 않으면 약도 개발되지 않고 연구도 되지 않죠. 있어도 없어야 되는 게 의학산업이죠. 어차피 일반인에게 오는 건 의학이 아니라 의학산업 전반이죠.
2187,2187,우리애들어릴때감기들면아스피린먹이면낳았어요
2188,2188,"도움이 되네요. 홍선쌤은 요즘추세가 기능의학쪽으로 가시는것 같아요. 주류의학계에서는 별로 안좋아하는 쪽이죠.  그래서 외롭겠지만 소신을 가지고 많은 대중을 이끌어 주세요. 주류의학에 있으면서 ,더러운 돈 많이 벌면 뭐해요! 대한항공의 그녀들이 돈이 엄청 많지만 저는 전혀 안부러워요.  쌤도 돈 적당히 버시는 쪽으로 하시고 욕심내지 말고 소신을 밝히는 대중을 위한 의학자가  되세요. 그러면 당연히 돈다발이 굴러올거에요.^^ 전 요즘 한국의 의사들  특히 산부인과의사들이 미워지네요. 저출산이라 환자가 줄어들어 힘든건 아는데  무조건 외래가면 초음파 들이대고  결국 제왕절개로 강매하고....이렇게  해서 돈벌면 양심이 허락할까요?  아무쪼록 앞으로도 기능의학의 선봉장이 되어주세요. Msm,비타민c,코큐텐,셀레늄등 많은 사람들에게 알려주세요."
2189,2189,"mike wazowski  공감해요;;; 산부인과, 검사와 수술만 강조하고, 식이라든지 원천개선에 대한 정보나 사실은 ㅠ혼자 공부해야하는 한국현실 ㅠ"
2190,2190,비온뒤 출연자보면 다 잘나가는 의사쌤이고 이것도 보면 기능의학이아니고 주류의학의 연구 결과를 말하는데 진짜 자기 편한대로 해석하는군요ㅎㅎ 웃고 갑니다.
2191,2191,아스피린의 효능 알고 있는 세계인들이 다 먹고있고 건강해지고 있는데 한국인만 건강해질 기회를 놓치고 있으니까 안타까워서 방송한거지 여기서 기능의학이 왜 나옵니까? 기능의학에 아스피린이 말이되나요? 의약품 부작용이 싫다면 관련 영양제 꾸준히 먹다보면 도움이 되거나 예방이 되겠지요 의학이면 의학이지 그걸 또 부류를 나눠서 홍혜걸 선생님을 아웃사이더로 몰고 가지말아주세요
2192,2192,Dog Pig 누가 아웃사이드로 몬다는건지...착각하는 약을 많이 먹었나?
2193,2193,mongmong Lee 여기도 정신과 갈 사람들이 많이 모이는  곳이구나...
2194,2194,거의 모든 것의 역사 왜 이게 기능의학이 아닌지 모르겠네.
2195,2195,"mike wazowski 최근 기능의학, ,안아키(약안쓰고아기키우기),대체의학 민간요법 이러한 것들이 마치 사이비들의 의학인것 마냥 취급이 되고 있어요 옹호하는 자들 보다 아닌자들도 많다는거죠 기능의학 자체를 이해하지 못하는게 아니라 그런 논란의 중심에 있는 기능의학이라는  단어로 엮지 않았으면 하는거죠 막상 사람이 진짜 아파죽겠을때는 주류의학이 갑입니다"
2196,2196,"mongmong Lee 정신병자야, 밥처먹고 잠이나 자라."
2197,2197,mongmong Lee 그래 너 같은 인간들 한테  이렇게 하라고 가르친다. 넌 니네 어미아비 한테도 이따위식으로 말 하면서 생활하냐? 이 식충아!
2198,2198,Dog Pig 안아키 극혐 없어져야할 집단들
2199,2199,아스피린을 복용하면 심장병 발생확률이 190% 증가한다고 들었습니다.
2200,2200,그렇지 않다는 반론이 나왔습니다.
2201,2201,홍박사님.감사.또감사.해요계속.해서.강의.하시면.국민.훈장.감.입니다최고.강의.잘보고.명심.해서.들었습니다
2202,2202,ㅈ
2203,2203,홍박사님  국민건강에  유이한 약을  왜팔지않나요  ?  정부에서  빨리 약국에서  팔도록  보사부장관은  즉시  조치해줄것을  건의합니다
2204,2204,바이엘아스피린만  없었지그때  한미아스피린은 계속 쭈욱판매했었는데용? 뭐지?
2205,2205,유명한 홍해열 씨 받갑습니다. -- 아스피린... 좋아요.
2206,2206,통풍 에도 좋은가요
2207,2207,건강정보 감사합니다️
2208,2208,안녕 예쁜이.  잘 지내시 길 바랍니다.  새해 복 많이 받으세요
2209,2209,long-term use 부분에서 500mg 짜리 아스피린을 사용했나요?100mg 내외의 용량을 적용하는 게 부작용을 최소화하는 방법입니다.아스피린이 COX저해제로 작용하는데 이후의 약물과 다르게 이 기전이 비가역적이라 고용량은 위험이 있다고 판단한 것이 아닐까요?의사라는 위치에 계신다면 음모론 이전에 이런 설명을 덧붙여 주셔야 합니다.100mg 용량은 일반의약품으로 판매 중입니다.
2210,2210,"요한복음(요) 1장12. 영접하는 자 곧 그 이름을 믿는 자들에게는 하나님의 자녀가 되는 권세를 주셨으니12. Yet to all who received him, to those who believed in his name, he gave the right to become children of God--"
2211,2211,
2212,2212,"세상에  대어난 아기가맨처음 만나는 스승은부모다 따라서 자녀가성장 하면서 부모의 영향을 크게 받으며 성장한다 또 ""윗물이 맑아야아랫 물 ""수신제가  치국  평천하"" 란말이 있다 즉 스스로 자신을 수련하고 가정을다스릴줄 알아야 나라를다스릴줄 아는 법이다 란교훈이 있는데 대통령이되겠다는 사람이 제 자식과 가정도 다스리지못하다니 말이  되는가"
2213,2213,특별히 심장병이 없는 사람들은 베이비 아스피린 복용 후 위궤양 위출혈 등의 부작용이 더 많은데.....미국 의사들도 이제는 안 권하는데...
2214,2214,가장 권위있는 USPSTF 가이드라인대로 말씀드린 겁니다
2215,2215,"현재45세 남성 이구요,30대초반부터 혈압약 처방받고 있습니다. 10대 때부터 정말힘들게하고, 고질병이던 편두통이 혈압약 먹은후로 거짓말처럼 사라졌습니다. 혈압약에 들어있는 아스피린 의 효능이라고 오래전부터 짐작하고 있었습니다.ㅎ"
2216,2216,Christopher SO ㅑ
2217,2217,Christopher SO
2218,2218,"유투브에 처음으로 댓글을 달아봅니다.왜냐하면 이 영상을 보고 어제 500g의아스피린 한알을 복용하고 어제 새벽부터 지금까지 엄청나게 괴로운 위염같은 증상 시달리고있어서요ㅠ 저는 독일에 사는 학생이고 보통 아플때 타이레놀을 먹습니다. 평소 특정약품에 대한 알러지반응은 전혀 없었고 심지어 예전에 발족욕용 알약을 비슷한 알약과 혼동해 먹었다가 독일 독극물중앙센터에 가서 혹시 모를 부작용으로 검사까지받았지만 아무문제가 없었구 평소에도 거의 모든음식을 소화해내는(?)장기능을 가지고있습니다.그런데 저는 의학지식이 없는 상태에서 홍혜걸님의 비디오를 보고 조금은 naive 하게 아스피린 500g을 복용하고 나서 구토 발열 위가 찢어지고 불이나는것 같은 증상에 시달리고있어서 혹시 저 같은 분들이 있을 수 있기에 답글을 남깁니다.  참고로 독일은 아파도 병원에 미리 몇주부터 예약을 해놔야하는시스템인 경우가많아 이런경우 정말 난감합니다.꼭 필요한 분들에게는 정말 좋은 약이될 수있지만 또 어떤분들에게는 독이 될 수도있으니까요. 제가 직접 체험하니 부작용에 대해서 좀 더 충실히 설명을 해줬으면 좋치않았을까 생각이 듭니다..왜냐면 한 독일 홈페이지에 보면 100g아스피린 부터 500g까지 각 용량마다 아스피린을 복용시 자주나타날수있는 부작용부터 심할경우의 부작용까지 다 나와있습니다. 예를들어 아래와같이 500g이상으로 그램수가 높아질수록 자주 나타날수있는 부작용에 대한 언급이있습니다. 사실 이 부작용 부분은 홈페이지에서 확인할수있듯 100g조제에서도 비슷합니다. ""B. Hohe Dosierungen (ab 500 Milligramm)Häufige Nebenwirkungen:Magen-Darm-Beschwerden wie Sodbrennen, Übelkeit und Erbrechen, Bauchschmerzen.""(500g이상의 높은 도제량의 아스피린에서 자주나타날수있는 부작용: 속쓰림, 메스꺼움, 구토, 복통과 같은 위장고통을 유발할수있다.) 자주나타날수있는 증상이기에 부작용부분에 꼭 언급이 필요했던 부분이 아니었나싶구요, 심하면 심지어 자주나타나는 증상은 아니더라도 아주 심한 부작용을 유발할수있는 약이기도합니다. 출처: https://www.onmeda.de/Medikament/Aspirin--nebenwirkungen+wechselwirkungen.html다른 예로는 독일에서 엄청나게 성공을 거둔 아스피린이 영국에서는 한번 큰 실패를 맛보았다는 기사를 읽은적이있는데요,  이유는 육식 치즈 유제품 섭취가 많은 독일사람들에 비해 상대적으로 생선 채소등을 많이 섭취했던 영국인들에게는 아스피린이 대한 부작용이 꽤 심했었다고 합니다.아무튼 저처럼 영상보고 너무 바로 혹해서 아스피린 500g 복용하시마시고 꼭 본인 증상을 위해 필요한 경우만 드시길 바래요. 위 고통이 너무 너무 괴롭네요ㅜㅜ 위를 부여잡고 글을써봅니다..."
2219,2219,아스피린 절대 드시면 안되요 저희 어머니 저용량아스피린 15년복용하셧는데 심장이 붓고 눈이 흐려지고 심장이 아파하는 현상이 일어납니다. 미국fda에서도 작년에기존에 입장을 완전히 바꿨습니다 ..ㅜㅜ 오래복용하면 할수록 복용기간에 비례해서 빨리 죽습니다
2220,2220,안녕하세요. 비온뒤의 김용태  PD입니다. 아스피린 부작용에 대해서도 고민하겠습니다. 빨리 쾌차하셨으면 좋겠습니다. 독일은 의사를 만나는 것이 어렵다는 것이 조금 놀랍습니다.
2221,2221,위가 고통스러울 때 위를 다스려주는 약을 같이 섭취하시는 것을 권장합니다. 단지 500미리그램의 경우에는 소염진통이 목적이기 때문에 예방목적으로 드시지 않기를 추천합니다.
