,Unnamed: 0,댓글
918,918,안녕하세요. 비온뒤 김용태PD입니다. 아스피린에 대한 최신 정보를 영상으로 만들었습니다. 지금 댓글 다신 영상은 3년 전 영상이라 새로운 정보가 궁금하시면 링크 참고하시기 바랍니다. https://youtu.be/gM1d-Uc6s2I
919,919,아스피린은  지혈이 되지않는 부작용이 있다고  합니다.
920,920,급히 병원 안가도 두알먹으면 금새 나았음 비싸지도 않고좋았는데 이유없이 판매금지
921,921,약간의 당과 혈압 코레스톨 심장병이 있는데 의사가 100mm 아스피린을 처방해줘서 복용중인데 첨엔 왜 아스피린인가하고 의아하게 생각했는데 중년 이후부터는 아스피린 복용이 필요한걸 아는 사람은 이미 알고 있었다. 암튼 닥터 홍의 아스피린 예찬론에 적극 공감한다. 만일 한국서 구입하기 어렵다면 해외 직구로 뚫어 보길 권한다.
922,922,"감사합니다,"
923,923,대한민국에서 태어난 것은 영광입니다 .정법강의(우리국민 인성교육)들을수 있는것도 영광입니다
924,924,선생님 ! 자세한설명 감사합니다. 저는 고지혈약과 혈압약을 복용하고 있는데. 고지혈약을끈코 아스피린을 복용하면 어떨까요?  꼭 답변주시면가사하겠습니다
925,925,"고지혈증, 혈압약과 함께 드셔야합니다"
926,926,아스피린  슈퍼에서도 판매할수 있어야 합니다
927,927,이부부 참 솔직하고 투명해 보여서 좋아요
928,928,입툭튀 아줌은 놉
929,929,10년정도  먹다가  끊었는데 다시  먹도록해야  되겠네요 좋은정보  감사  합니다
930,930,안녕하세요?ㅎ아스피린 어떻게 사나요?ㅎ감사합니다.저는 55년생입니다.
931,931," 외할머니 아스피린 매일 복용하고 101세 까지 사셨는데,  80대 며느리가 모시느라 수고 많았어요.^^   적당히 살고 천국 가야 며느리가 편하다.."
932,932,ㄷㄷ
933,933,죽는다는게 마음대로 되는게 아니니....며느리 혼자서 모셨다면 많이 힘드셨겠어요
934,934,선생님 이스피린먹고 건강하면 병원수입 이 줄어드니 먹게 할까요? ㅎㅎㅎ
935,935,귀한정보입니다아! 감사합니다정보알게해주셔서
936,936,우리도 복용할 권리가 있다 !
937,937,저도   아주   어렵게구했는데요   염증에   두통에   바로  효과봤어요근데   구하기가힘들어요 ㅠㅠ 
938,938,5년 전에 이미 아스피린의 여러 유익한 효능을 얘기 한 사람이 이제서야 100mg 복용을 고려해 보겠다.
939,939,박사님 아스피린 구입할 수 있을까요 아스피린병으로 살수 있으면  3병 사고싶어요  꼭 부탁드려요  답변주실수있으시면꼭 부탁드려요  약국에서  병으로 안팔더라고요.
940,940,바이엘약이 약국 마진을 많이 안주는 것으로유명 다른 바이엘 약도 구할려면 하늘에 별따기  바이엘사 약 달라면 원료가 같니 어쩌니 하며 다른제약사 권함
941,941,감사함니다.이렇게좋은약인줄을몰란네요..오늘이글읆.보게된것으간사합미다
942,942,"뇌출혈로 수술행던 사람입니다,  더빠르게 뇌출혈을 진행시킨 원인이 아스피린이라고 들었어요."
943,943,좋은정보감사해요
944,944,멋지십니다 공익을 위해 이러한 말슴 하시기 힘드셨을텐데 멋지세요
945,945,84세 어머니께서 9개월 전에 고지혈증 진단 받고 심장내과 약처방받고 있습니다. 아스피린 약이 더 효과적인 방법인지 다음진료일에 주치의에게 어떻게 질문해야 할까요
946,946,감사합니다
947,947,참 좋은 빅 뉴스다
948,948,맞아요 전 대학병원 에서 큰수술햇는데 피를 물게한다고 심장또 어지럽고 할때도 도움이된다고해서 여러가지좋다고 의사선생님께서 아스피린 을꼭 하루에 한알씩먹으라고해서 먹고잇네요
949,949,한국의 약물 부작용이 세계3위권이던데 이렇게 좋은 아스피린 제조판매는 중지하는건 정부와 제약사들간의 연합꼼수가 분명함
950,950,다른 더 비싼 약들을 팔아 먹자는 수작인기요?
951,951,아스피린.좋와요참고하시고.드세요저는몇년전부터먹고있어요
952,952,홍박사님감사드립니다나라 정책썪여자빠졌다네요ㅉㅉ
953,953,다 좋은뎅..  응급상황에선 위험할수도.. 피가 지혈이 잘 안뎀
954,954,미국서 아스피린 아주 싸게 파는데 좀 사서 보내드려야 겠네요. 한국서 아스피린 안 하는 줄 몰랐어요.
955,955,사서 좀 보내주실수있으시면 답변좀주시면좋겠어요
956,956, @참나리  해외직구로 ..?!~~~
957,957, @참나리  11번가에 아이허브 아스피린 검색해보세요 1만원이면 사요
958,958, @그린개구리  답변문자감사해요
959,959,커클랜드에서 81미리 남대문 수입상가에 가면 많이 판매합니다저도 5년동안 혈압약과 같이 복용하고 있습니다
960,960,스위스 에서도 중장년 층은 cardio aspirin 100 ml  매일   복용 하는 사람도 많습니다 저도 애용하는 편입니다
961,961,아스피린을 먹으면 감정이 둔해진다는 연구결과도 있습니다. 아스피린이 신경 작용 전반을 둔하게 만드는 역할을 하는듯
962,962,저는 50중반에 목뒷골이 너무아퍼서 아스피린을 아스피린 먹기시작하면서  아픈증상이 사라져서10년 정도 먹고 건강합니다.
963,963,저는 오랜동안 미국에서 선물로 보내와서 먹고있읍니다 내시경 검사때는 3일간 안 먹었지요 이빨 뺄때 먹고서 뺏는데 지혈이 안돼서 조금 힘들었어요 좋아요
964,964,"선생님 아스피린 매일 먹으면 피가 너무 묽어져서,  장기복용 하거나 하면 혈우병 처럼 피가 지혈이 안되는 단점도 있다고 들었는데...엄마가 고혈압에 당뇨에 툭하면 여기저기 아프다 하셔서 진통 소염제로 드릴려고 사왔는데요. 매번 드리기엔 걱정스러워서 가끔씩만 드리려고 하는데,  최소 한달에 한번? 일주일에 한번? 이런식으로 아주아주 안전한 가이드 라인좀 잡아주시면 감사하겠습니다."
965,965,혈우병과 전혀 관계없고 지혈안된다는건 과장된 이야기입니다 100밀리그램 하루한알 드시면 되고 의사 상의아래 드실것을 추천합니다
966,966,1000%. 동감 입니다.  얼마니 사고싶은데
967,967,너무 감사합니다
968,968,궤양성 대장염 환자도 먹어도 될까요?궤양성 대장염 약을 복용하고 있을시에도 아스피린 100mg 복용해도 괜찮을까요?
969,969,바이엘 아스피린 의 효능정말 대단하네요.우리 어릴쩍에 많이 먹었슴니다.
970,970,지금바이엘  아스피린구하려면  국내  약국에가면  구할수  있나요~~?
971,971, @김정구  네 지금은 팝니다.전 오늘 구매했어요.500mg 20정 5천원에 판매하네요100mg짜리 있으면 그걸로 드시면 되실것 같아요
972,972, @백화비  헐  ~대단하시네요.  저는오늘약국에  갔는데   안팔던데요~~?
973,973, @김정구  다른 약국 한번 가보셔요.저는 생각나서 산거라..혹 모르니 전화로 문의해보고 가셔용~~!!
974,974, @백화비  네.  감사합니다.^^
975,975,고지혈증에도 도움이 되는지요?저도 100mg  해외 직구 하였습니다
976,976,다른 약을 처방에 따라 상복하는데아스피린을 따로 먹어야하나요? 같이 먹어야하나요?
977,977,네  너무 소중한 정보 잘 보았습니다.
978,978,손목통증때문에  밤새고생했는데  빈속에  100미리  아스피린복용해도 괜찮겠죠
979,979,"한국에서 아스피린을 취급을 하지 않는 이유에 대해서 궁금하신 분들이 많은거 같아서 개인 소견을 전하면 ""세계에서 가장 약품통제를 심각하게 하는 국가""라는 사실이 있기 때문이지 않을까 싶습니다. 이로 인해 가격이 싸고 좋은 약들이 시장에 진입하기가 굉장히 힘듭니다. 비교를 하자면 미국은 편의점에서 3만여종의 약품을 구매를 할 수 있고, 일본은 편의점에서 2천여종 이상의 의약품을 구매를 할 수 있는데 반해서 한국은 편의점에서 16개의 약품 외에는 판매를 못하도록 되어 있습니다. 이마저도 현재 약사들이 집단 데모에 나섬으로서 내년부터는 편의점에서 어떤 의약품, 밴드조차도 판매할 수 없도록 되어버릴 거 같습니다. 국민들도 별 다른 저항이 없는 상황이니까요.자, 의약품 통제가 이렇게 심하다보니 결국 약재의 공급이 소비자, 환자 중심이 아니라 의사, 약사와 같은 이익집단 중심으로 돌아가게 됩니다. 즉, 제약회사들이 한국에서 약을 팔려면 환자나, 소비자들을 중심으로 해서 마켓팅을 하는게 아니라 의사와 약사들을 대상으로 해서 마켓팅을 해야 한다는 것이죠. 그럼 그 의사와 약사들이 약품을 처방, 혹은 판매할 때 어떤 약들을 우선 판매를 할 지에 대해서 생각해봐야겠죠.첫번째가 리베이트를 잘 주는 회사들입니다. 이 사건이야 너무 유명하니 다들 잘 알지요. 국내 제약회사들이 의사들에게 고가의 수입차량이나 현찰을 주고, 자사의 약품을 많이 처방해달라고 요구를 하는 것이죠. 바이엘사는 이럴 필요성을 느끼지 못하는 것일테고요.두번째가 마진이 높은 회사의 약품들입니다. 즉, 약사들 입장에서는 꼭 같은 약품을 팔아도 이윤이 많이 생기는 약품을 파는게 당연히 이득이 될 수 밖에 없죠. 헌데 아스피린은 원체 저렴한데다가 복제약도 시장에 많이 있기 때문에 굳이 아스피린을 판매해야 할 이유가 없다는겁니다. 복제약을 아스피린보다 저렴하게 공급받을 수 있으니 돈도 안되는 아스피린판매는 당연히 소비자가 따로 찾지 않는 이상은 볼 일이 없는거죠.헌데 흥미로운건 이렇게 약품 통제를 심각하게 하는 국가가 세게 최대의 의약품 남용국가라는 사실이 있다는겁니다. 일본이나 미국에 가서 감기로 치료받아본 사람들은 알겠지만 감기약 자체를 거의 처방하지 않습니다. 헌데 한국에서는 2~3종류의 항생제는 기본으로 처방을 해버리죠. 그리고 외국에서는 굳이 약을 처방을 해도 하루 이상의 약을 처방하는 경우가 10억분의 1의 경우도 잘 없습니다. 헌데 한국은 3일치를 기본으로 처방을 하죠.이런 한국의 약 처방 현실을 한 언론사가 취재를 해서 외국의 의사들에게 보여주었더니 한마디씩 하죠. 미친 놈들이다 라고요. 이 사실때문에 한국이 세계 최대의 의약품 남용국가가 된 사실을 알 수가 있습니다. 한국이 의약품을 통제하는 이유가 의약품 남용을 막기 위해서라는 이유였는데 실제적으로는 의사와 약사와 같은 이익집단들이 자신들의 이윤극대화를 위해서 약재시장을 사실상 교란, 소비자와 환자들의 주머니를 털어먹고 정당한 약재시장 경쟁이 이루어지는 것을 막아왔다는겁니다. 당연히 이로 인해 신약개발의욕은 저하가 될 수 밖에 없고, 소비자와 환자들은 같은 약을 먹어도 더 효과적이고 부작용이 적은 약물을 만날 기회를 원천적으로 박탈당할 수 밖에 없는 것이죠. 문제는 정치권이 이런 소비자와 환자들을 중심으로 해서 정책을 펼치는 것이 아니라 자신들에게 로비를 하는 이익집단을 위해서 정책을 펼치고 있기 떄문에 소비자와 환자들은 앞으로도 좋은 약을 좋은 가격에 만나는 것이 사실상 불가능하지 않겠는가 하는 생각이 들어요."
980,980,좋은 의견 감사합니다 혹 이 글을 저희 비온뒤 기사로 그대로 가감없이 올려도 되는지요?
981,981,개인의 소견일 뿐인데 필요하시다면 취하셔도 상관은 없습니다.
982,982,Cvs가보시면 놀랄겁니다 다들
983,983,그 다큐 저도 봤었는데 오래전에봐서 정확하게 기억은 안나지만 외국의사가 처방전을보고 하는말이 자기 가족이라면 이렇게 처방하겠는가 이런 뉘앙스로 말했었던것 같네요
984,984,"예. 한국은 세게 최대의 의약품 오남용 국가이며, 이런 현실에는 의사와 약사같은 환자의 목숨을 팔아 돈을 버는 이익집단들의 횡포가 무엇보다 큰 역할을 하고 있습니다. 한국의 의사들은 신뢰할 수 없는 집단이며, 얼마나 많은 환자들에게 자기들의 돈 벌이를 위하여 불필요한 약을 처방하고 있는지 짐작조차 하기 어려울 정도로 환자들에게 큰 경제적, 심리적 부담을 주고 있습니다. 이런 집단은 전세계에서 한국 외에는 찾아보기 힘듭니다."
985,985,외국에도 안팔아요. 이유는 대충 알것같은데 음모론 어쩌구 할까봐 여기까지
986,986,진짜 헬조선이 괜히 나온 단어가 아니다
987,987,근데 내용은  알겠는데  아스피린  부작용 중 뇌출혈  가능성이 30프로  넘는다면 약일까요  쥐약일까요 ?부작용 내용중에  있던데  여자 의사가  뻥치는건 아닐테고 진실이  뭔지  말해주세요
988,988,와~ 약피아 의피아들이네... 개인의 견이실진 몰라도 많이 배워가네요!!
989,989,우리나라는 한의사한테 침맞으면 모든게 낫기때문이죠 ㅋㅋ 침ㅡㅡㅡㅡㅡ통
990,990,홍혜걸 선생님잘하셨습니다화이팅!!!!!
991,991,아무것도 모르고먹엇는데자세히알게되어서감사함니다
992,992,맞습니다 저두 어릴때 감기걸리면 아스피린 먹고 나았습니다
993,993,발포 아스피린 진짜좋던데 빈속에 먹어도 되고 ..가끔 감기증상있을때 먹으면 직방
994,994,귀한방송 잘 들었어요
995,995,홍박사님을 국회로 보냅시다~
996,996,오랜만에 영상봅니다~아스피린 사러 나가려다...ㅎㅎㅎ한번 이 영상  보고 사려고요..
997,997,"의사들이 안좋다고 해도 먹습니다, 먹은지 2년되었는데 종합검진 받았는데 많이좋아졌네요, 무엇보다 아침에 일어나면 띵하고 정신이 무거웠는데 이것때문인진 몰라도 개운합니다. 90원도 안하는데 이만한 예방책은 없는것같습니다."
998,998,뭔데요? 저도좀 저도 항상머리가무겁고띵해서요
999,999,맞아요
1000,1000,위에 바보님들 아스피린 먹는다는거잖아요.
1001,1001,식전ㆍ후 상관없는지요?
1002,1002, @김영진  ㅣ
1003,1003,대단하네요
1004,1004,한국의사분들이 아스피린을 권장하지 않는 이유가 피가 묽어져서 외과 혹은 치과 수술에 약간 불편하기 때문으로 추정된다.
1005,1005,맞습니다. 뭔가 꼼수가 있는거 같네요값싼 아스피린 때문에 값비싼 다른약이 안팔니까 그런거 같은데 식약청에 항의를 해야 되겠네
1006,1006,이게 혈관이 약한 사람들은 먹으면 안됩니다. 캐나다에선  슈퍼에서 파는 아스피린이지만.
1007,1007,국민청원합시다~~아스피린 판매해야된다고!
1008,1008,우리작은애가 가와사키걸렸을때도 아스피린 한달먹었네요..피를 묽게하는 효과가있다고..심혈관합병증이와서 퇴원해서도 한동안먹였는데..잘은몰라도 우리아이 낫게해준 고마운약입니다
1009,1009,리리슈슈 혹시라도 이 댓글때문에 소아에게 아스피린을 먹이는 일은 없도록 해야합니다. 아스피린은 라이 증후군의 위험때문에 소아에게 금기이고 가와사키증후군을 가진 아이에서만 예외적으로 투여하는 것입니다.
1010,1010,난 가와사끼걸렸을 때 포카리만 계속 먹였다던데..
1011,1011,그런데 말입니다. 쭉 듣고보니 약국가서 당장 사고싶어지네요
1012,1012,감사합니다매일 먹는거를 시작해 봐야겠습니다넘 감사합니다
1013,1013,이렇게 좋은 아스피린을 왜 생산 하지 도 팔지도 않읍니까ᆢ국민들이 일어나서 항전해야 합니다ᆢ
1014,1014,아스피린에 부작용에 관한 질문입니다. 저희 가족들에게도 아스피린을 권장하려고 하는데 아스피린을 오래 먹으면 지혈이 되지않는다고 걱정들을 하시네요 걱정해야하는게 맞는지 궁금합니다.
1015,1015,지금은 파나요? 처방받아서만 복용가능한가요?
1016,1016,아스피린 판매 재게하라 국내 제약회사들과의 커미션이 있었을거임청원들어가야함
1017,1017,갓바쿄신 타이레놀이랑 가위바위보해서 진게 아닐까요? 이건 영업부에서 잘못한거 같은데  ㅋㅋ
1018,1018,mongmong Lee 한알에 100원 짜리 돈 안되니까 아무래도ㅡㅡㅋ
1019,1019,mongmong Lee 님 술드셨으면 얼른 주무세요
1020,1020,mongmong Lee 알았어 미안하다 얼른자라 내꿈꾸고
1021,1021,mongmong Lee 님 한국얀센 직원임? 아세트아미노펜은 소염은 안된대자너 나는 소염이 좋다  소염이 뭔줄 아나? 염소말고 소염 나 비온뒤 직원 아니다 여에스더 선생님 팬이다 님 심심한거 같아서 내가 놀아줬으니까 이제 그만하시고 양치질하고 주무세요
1022,1022,mongmong Lee 비온뒤 직원 아니라니까요? 험한욕 험한욕 심한말 심한말 심한말 심한말 심한말 험한욕 자꾸 오해를 하니까 상종을 안할래도 안할수가 없네 님 아이큐 높지? 이런 천재같은분이 한국얀센에서 일하니까 타이레놀이 잘팔리지 님이 이겼음 내가 무조건 님보다 밑임 님은갑 나는을 오케이? 인정?
1023,1023,mongmong Lee 그러니까 님은 내가 홍박사님이고 아이디 바꿔서 너랑 노닥거리고 있다고 생각하고 있는거지? 님은 그게 의문이고 잠도 안오고 내가 꼬박꼬박 대답해주니까 슬슬 재밌고? 홍박사님이 님이랑 내수준 인줄 아나? 서울대 무시함? 님아 여기서 이러지 말고 우리 만나서 얘기합시다 님 어디약국임? 내가 타이레놀 5만원어치 사줄게요 안티임 찬티임? 정체를 모르겠네 그래서 아스피린 싫다는거죠?싫으면 안먹으면 됨만나게 되면 손잡고 역삼동 진실정신의학과 한번 갑시다우리 둘다 도파민이 부족한것 같으네요 개는 데리고 오지 마세요
1024,1024,재개
1025,1025,mongmong Lee 정신병 있냐?
1026,1026,mongmong Lee 장애는 약도 효과가 없는데.
1027,1027,구독해서 박사님 유익한 의학정보 아라가겠습니다~### 도시농부 해피마마 오셔서 힐링도하세요
1028,1028,아스피린을 꾸준히 말씀대로 2년간 섭취 했는데요 .고추 껍질 부분의 혈관이 부분적으로 딱딱해지는 부작용이 있었어요. 섭취를 금하자 신기하게 풀어졌습니다.약을 함부로 섭취하는 것은 때로는 위험하다는 것을 깨달았습니다.고추를 조금만 만져도 혈관이 터지는현상도 있었어요.
1029,1029,아스피린  이 응급 구호약품인데  처방저없이는약국에서 구입할수없읍니다예전에는 마트에서도 구입했었는  불편합니다
1030,1030,다시 아스피린 각인.할수 있어 고맙습니다 .
1031,1031,그런데도 병원환자가 없어질세라  돈 벌려고  이 약을 다  숨겨놓은것 같군요  미친세상ㅡ
1032,1032,의사협회에서는 암환자가 많아야 돈벌죠
1033,1033,암환자 들 몇명이나 된다고 ㅋㅋㅋㅋㅋㅋㅋㅋㅋㅋㅋ
1034,1034, @금연  암환자 많아요.그리고 치료비 단가도 비싸죠.
1035,1035, @금연  의사들 몇명이나 된다고 ㅋㅋㅋㅋ
1036,1036, @금연  사망원인1위 암 인건 알고?? ㅋㅋㅋㅋㅋㅋㅋㅋ
1037,1037, @금연  암환자 한명에 수억 수익남
1038,1038, @금연  의사세요 ? ㅋㅋ
1039,1039, @금연  바본가?
1040,1040, @금연  1/3은 암걸리는데 ㅋㅋㅋ
1041,1041," @금연  우리나리 소형병원은 고혈압,당뇨환자가대형병원은 암환자가 먹여살린다는 말을 들은 적 있습니다.."
1042,1042,저는 아스피린을 상비약으로두고있는데 정말좋아요.몸이아플때 진통뿐아니라 치료까지됩니다
1043,1043,공감합니다 아스피린은  부작용만이주로  회자됐지  점점  밝혀지는놀라운 효과가  묻히는거는  누구를위한 것일까 생각합니다현재 아스피린 거의 일년간 매일 최소용량 한알씩 장기 복용중입니다  다른건 모르겠고제몸속  구석 구석의 염증은이녀석이  처리해 주고 있다고믿고 실제로 여러가지로느끼고 있죠  혈관건강을 위해운동도  신경쓰지만아스피린 가격대비 진짜명약입니다
1044,1044,ustygp rety 안녕하세요직구로 아스피린500mg사면 되는거지요?
1045,1045,100m  입니다구입경로는  알아서
1046,1046,근데 약에 의존하시면 오남용으로 안좋을텐데요정말 아플때만 드셔야지 매일드시면 안좋습니다
1047,1047,매일 한알씩은 중독아님? 님 그렇게 드시면 내성생겨서 먹는양도 점점 늘어나고 갑자기 안먹으면 금단형상 일어날거임... 그게 중독임 조심하세요. 님 사정잘모르겠지만 지나가다 위험하실거 같아서 글남깁니다.
1048,1048,구아아악 내성이 생기는 약이있고 안생기는 약이있습니다 야스피린은 내성이 없는약으로 유명합니다
1049,1049,ustygp rety
1050,1050,케미컬 이 만병통치약이 된건가요?당뇨약과 혈압약은 비타민같이 먹으라는 논리와같은논리
1051,1051,ustygp rety 2
1052,1052,H J
1053,1053,완전동감이며 발기부전도 효과 있어요
1054,1054,상당히 유익하였읍니다 한번상의해서검토하겠읍니다 감사합니다
1055,1055,"안녕하세요 선생님 영상은 잘 봤습니다만, 저희 집사람에게 복용하고자 하는데 나이는 1980년생 올해로 40살입니다 문제는 작년까지 혈소판감소증과, 뇌졸중이 있었습니다 그래서 치료도 힘들었습니다 피를 묽게 하면 혈소판감소증때문에 출혈이 심해졌고 굳게 만들면 뇌졸중이 겁이 났거든요 ...3년정도 사이에 3번이 뇌졸중이 왔고 운이 좋게 휴우증 없이 잘 회복하였습니다 그러던중 작년쯤 우연찮게 위내시경을 했다가 헬리코박터균 치료를 하게되었고 하면서 의사분께서 잘하면 혈소판감소증이 치료될수도 있다하여 기대를 했다가 기적처럼 혈소판 수치가 대폭 증가하여 현재는 1년 넘게 20만수치를 유지하고 있어 아직까진 혈소판감소증은 치료가 되었다가 보고 있습니다 ...이제 남은건 뇌졸중인데요...이게 말씀하신 아스피린이 효과가 있을듯하여 먹고자 하지만 조금 불안한 부분이 혈소판감소증이 치료는 되었지만 영향이 있진 않을까와 지금 뇌졸중때문에 매일 먹고 있는 와파린이 있는데 거기에 아스피린을 추가해서 먹어도 될까 싶어서 여쭙습니다 ...답변을 꼭 해주셨으면 합니다 ...기다리겠습니다 선생님"
1056,1056,코스트코 81g짜리 저용량 아스피린 직구하려고 하는데 괜찮은 선택일까요? 배송비가 좀 붙긴 하는데..
1057,1057,아스피린이 좋은거 알면서도 처방안해주는 의사들 고객 떨어질까봐 그러는듯생각이 들었는데요홍해걸님의 말씀을 들으니 속이 후련합니다 감사합니다
1058,1058,제약사 약사 의사 국민의건강을 워해 책임감이 있다
1059,1059,홍혜걸씨 고맙습니다 저도 먹고 있는데 아스피린 효과 보고 있습니다
1060,1060,어떤효과를 보셧나요?
1061,1061,홍혜걸님  정말 오랜만입니다..부인도 잘계시죠..우연히방송보게되내요!
1062,1062,저도 매일먹고 이런것까진모르겠는데어깨뭉침이나 두통있을때소염제로 아스피린먹으면그다음날 상당히 개운(?)한맛이 있더라구요관절 근육이더 부드러워진 느낌도들고 ㅎ그래서 진통제필요한 순간쯤엔다른진통제보단 아스피린 먹는게 좋더라구요
1063,1063,피가 너무 묽어져서 오는 부작용은 없을까요?
1064,1064,아스피린아니면 두통치료 어려운데 엄청 어려움 겼었음을!
1065,1065,저희 아버지께서 심장판막 수술 하셨는데 병원에서 아스피린 처방 합니다..혈전을 막는다네요
1066,1066,당장 아스피린  약국에 판매 하도록   하라   막는자처단해야 한다
1067,1067,친정엄마 추천으로 사려니 없어서 100밀리그램짜리 구매해서 가끔 먹어요.혈액순환에 좋다네요.500밀리랑 뭐가 다른가요?
1068,1068,최고 !!!
1069,1069,세상에 그런일이 있었네요전혀모르고 있었습니다.
1070,1070,염증 >발열>통증   ㅡㅡ소염>해열>진통  이게 순서겠죠.암도 일부 염증세포에서 발생한다고 보면암도 예방되는것이  옳다.
1071,1071,아스피린 부작용 심한거 아나몰라요?귀에도 이상이 온답니다 조심하세요
1072,1072,네 맞슴돠 아스피린강의감사
