,Unnamed: 0,댓글
629,629,당신들이 있어 대한민국이 자랑스럽습니다. 감사합니다(꾸벅) 위험수당 포함 급여가 대폭 인상 되었으면 합니다.
630,630,보통극한직업은 한가지의 큰위험요소가  있어서인데이직업은 진짜....보기만해도 아찔함...
631,631,왜 저런 곳에는 여자 한명이 없을까? 그렇게 할당제 하면서 저런일에는 나몰라라 ㅋㅋㅋㅋ 진짜 할당제 주장하는분들 반성해라 고위직만 얻을려고 하지 말고
632,632,mer ga 여자들은 전기쪽을 잘 안가요 근데 확실히 페미들 능력도 안되면서 좋은직장 원하는거 꼴보기싫더라고요 그러면서 영상에 나오는 직업 같은건 노가다라면서 개무시하고... 전기쪽도 자격증 있어야 하는건데 파워포인트같은 기본 자격증 하나 정도도 안따놓은것들이
633,633,mer ga 아니 갑자기 뭔 여자타령 ㅋㅋ웃기네
634,634,Bean Dedduck 개무시 안하는데? 니같은 애들이 여자들한테 무시당한다고 저런 분들까지 무시당한다 생각하지 마셈
635,635,하시오 안녕 제가모든 여자가 그런다고 했나요.. 페미라고 했잖아요 왜 혼자 찔리셔서 그러시는지.. 저 여혐 안합니다 페미만 말한건데 마치 제가 모든 여자분들 다 싸잡아 일반화 시킨거마냥 말하시면.. 암튼 기분 나쁘셨다면 죄송합니다
636,636,확실한건 남자들이 건축물짓고 보수하고 하는데 여자는 없음ㅋ
637,637,"소위 한 남 충이라고 불리기도 하는 아버지, 남편들이 가족 먹여 살리려고 위험하고 힘든 일도 억지로  하는 거죠.  마누라, 자식 없이 혼자 살면 돈 좀 덜 벌더라도 위험하지 않고 쉬운 일 찾아서 하겠죠. 이런 것도 모르고 한 남 충 이니 애 비 충 이니 하는 페미년들은 그냥 불태워 죽여야 합니다. 🤔"
638,638,현대의 99% 건물은 남자들이 지었죠 99%도 예의상
639,639,"다음,메갈,여시에서 활동하는 페미들만 따로모아다가 살라고하면 장담컨데 할줄아는것도 없는 무능집단일거임"
640,640,떨어진 사람은 말이 없다.... 와... 이 말이 이리도 섬뜻했나.....
641,641,안전 장비가  너무  부실하네 ㅜㅜ
642,642,존경스럽다
643,643,이게 짱이네.. 케이블카보다 더 위인듯.. 진짜 극한직업. 안전장비도없다니
644,644,저도 그거보고옴 ㅋㅋ
645,645,"이런분들이,없으면은,세상못살아간다잘한다,파이팅,극한작업"
646,646,와..........난 조선소에서 일하는데  월급 억을 줘도 저 일은 하기 싫다. 높은 송전탑을 안전고리 없이 맨손으로 오를때 헉!! 했고 전선 위를 이동하다 울퉁불퉁한 구간에서 훌라후프 안전고리 풀고  조심조심  이동하는거 보고 경악을했음.
647,647,월급 2억준다면요?
648,648,난 이분들이 한전 정직원이 아닌게 이해가 안간다ㅋㅋㅋ 대단하십니다. 정말 영상으로만 봐도 일하시는 강도가 대단하네요ㅠ
649,649,보고만 있었도 다리가 후덜 오금이 저리네요 존경 합니다
650,650,와 진짜 돈 얼마를 준대해도 난못할거같다....저직업은 담력이타고나야될듯....
651,651,그냥 돈많이들어도 송전탑 지하화했음좋겠네요
652,652,진심 위험하다ㄷㄷ돈으로 충분히 보상받으시기들
653,653,와.. 내 오금... 진짜 너무 위험한거 아님??? ㅜㅜ;; 진짜 돈 많이 받아야 하는 직업이다.
654,654,극한직업중에 거의 최고수준 이라고 해도 과언이 아닐듯 ㅡ 고소공포증 없다고해도저건 진짜 목숨 걸고 하는 일인듯
655,655,우리동네  송전탑  들어올때보니  바람  쌩쌩부는데  전선줄에  올라가  작업하는데  그  가족분들 그  장면  꼭  보시고  잘해드려야겠다는  생각 저절로  들더라  극한직업
656,656,와....난 몇백억을 준다해도 못할듯...대단하시다
657,657,진짜 미쳤다
658,658,한국전력 사무직 월급이 높을 게 아니라 저렇게 직접 작업하고 다니시는 현장직 분들의 월급이 대폭 높아야하는데 현실은 조금 높은수준밖에 안되니 원.....
659,659,이분들이 없었다면 집에서 편하게 전기를 사용못하겠쥬?? 정말 대단한 일을 하고 계시네요~~8:28 유격 외줄타기는 뭐 명함도 못내밀겠네...
660,660,보는내내 숨이턱턱막히네요..정말고생하십니다..요즘에 극한직업은 워터파크직원나오던디..실화냐..
661,661,돈 많이 줘도 전 못합니다... 열심히 일해주셔서 감사합니다.
662,662,정말대단하신기술입니다존경합니다
663,663,일하시는 분들 진짜 도를 텄네.. 등산 다니는 기분이라니..그래도 안전 장비들이 좀 갖춰졌으면 좋겠네요. 근무환경이 좀 열악한 거 같아요 ㅜㅜ
664,664,우와 대단하다 최고다.
665,665,1산길 2고공(낙하위험) 3고전압 정말 위험한 3디업종인데 존경스럽다
666,666,극한직업pd도진짜 대단하다
667,667,진짜 너무 위험하다..저런일은 드론이 해야ㅠㅠ...돈도 돈이지만 안전이 먼저니까ㅜㅜ....
668,668,"나도 송전탑쪽 관심있었는데 체력,  당력까지 장착해야하네... ㅎㅎ"
669,669,대단하다 나는 돈 아무리줘도 절대 못한다…. 리스펙
670,670,저런분들 목숨내놓고 하는건데많은 돈좀 줬으면좋겠다월급천만원이여도 부족할거같은데  ㅠ고생많으십니다 조심항상조심하십시요
671,671,정말 감사드립니다.
672,672,누군가의 목숨을 건 작업을 이젠 끝내야한다..송전 배전 작업 모두국민들이 조금 불편하더라도 정전시키고 안전을 확보한 상태에서 작업하도록 해야한다..ㅜ.
673,673,저분 가족들은  정말 날마다 가슴 졸이겄다   위험해  무서워보여요
674,674,가족들도 아마 이번 방송보고 우리 남편이 우리 아빠가 저렇게 위험한 일을 하는구나 한 사람들 많을겁니다.저런일 하는 분들 대부분 집에 가서는 힘들고 위험한거 일절 얘기 안합니다.
675,675,ㅈㄱ
676,676,그러면... 그런분 밑에서 태어난 자식들도 흙수저나 마찬가지? 가족(아빠) 걱정이 한가득이여서? 비운의 사람들... 로봇으로 대체해야합니다.
677,677,그냥 개무식하게 하는거 같은데 죽을 놈 죽으라는거네
678,678,저는 빌딩 외벽로프공인데 가족들 그냥 공사 현장에서 일하는줄암 ㅋㅋ 얼마나 위험한지 가족들한테 말하면 걱정만할듯
679,679,가족들도 덜덜 떨면서 영상을 봤을듯하네요
680,680,나약한 제 자신을 반성하고 갑니다. 항상 감사하며 열심히 살겠습니다.
681,681,장비가 너무 허술해 보여서 진짜 아슬아슬하다.
682,682,멋있다ㅡ  정말 감사합니다
683,683,낙하산 메고 작업하셔야 하는 거 아닌가? ㅠㅠ 진짜 연봉 팍팍 올려주세요 ㅠㅠ 아 너무 고생하십니다 감사합니다 ㅠㅠ
684,684,저 작업을 꼭 저렇게 해야하나? ㅠㅠ 너무 위험해ㅠㅠ먼 작업 장비를 일일이 다 손수 올려야하네 ㅡㅡ
685,685,"와 현기증난다. 정말 대단들 하십니다. 항상 감사드리고, 노고에 박수를 보내드립니다."
686,686,와 50세이신데 경력이 32년이면 엄청 어릴 때 부터 하셨네
687,687,송전탑 앞에서 안전로프 풀고 가는거 보소 ㄷㄷ
688,688,화면으로 봐도 어질럽고 무섭운데 특수부대 저리가라네요 존경합니다.
689,689,대단하세요 그리고 감사합니다
690,690,이건 진짜 위험해보이네
691,691,장비들이 21세기에 맞게 좀 변화를 줬으면 하네요~이건 한전이 규격이나 it장비를 개발 해줬으면하네
692,692,현업 전기공사 업체 사장입니다. 지렸습니다 갈아입으러 갈게요~ 존경합니다.. 전 건물밖은 거들떠도 안볼게요...
693,693,응원합니다.
694,694,와 저걸 ..사람이..대단하심..
695,695,높이만 봐도 아찔한데 대단하네요
696,696,고소공포증이고 뭐고 저 200키로 달고 어떻게올라가고 도중에 포기하기라도하면 답없는상황인데 진짜........존경합니다월 2천씩은드려야할듯
697,697,와.. 보는 내내 손발에 식은땀 줄줄 흐르네
698,698,월급 2천은 줘야된다 ㄹㅇ ㅋㅋㅋㅋㅋㅋㅋㅋㅋ 시발 진짜 저기를 직접 올라간다는건 상상도 못했네 ...
699,699,인간적으로 안전장비 너무하다..보는내내 참담한심정으로봤다 산업안전공단과 한전측에서 이분들 안전장비에대해 좀더 신경을써야한다. 책상앞에앉아있는것들 저 전선위로한번보내봐야 정신차리지ㅡㅡ
700,700, @인혜처럼축구는  어딜가나 이렇게 삐뚤어진것들이있지.. 사회부적응자들.. 당신같은사람들보면서 오늘도 바르게키워주신부모님께 감사하다는생각을한다
701,701,앗! 저 학생이라서 맨날 책상 앞에 앉아서 펜돌리면서 공부하는데....전 바이킹도 못타요 ㅠㅠ.....
702,702, @인혜처럼축구는  니 말하는게 반말보다 더 싸가지없음
703,703,니가 가셈 ㄱㄱ 입만터는 여포가 따로없누
704,704,작업하는 것을 보는 주민이 민원 넣으면 먹힐듯
705,705,근데 저게 가로등 전선도 아니라서 철 탑이라서 안전 장비 로 생각 할게 없어요.. 저기에 뭐 거는게 최선이고.. 저게.. 높다 보니까 기계도 한계치 있고 하니까 어쩔수 없는데.. 저분들이 있어서 우리가 전기를 쓰는거에 대해 감사를 느끼는수 밖에..
706,706,한전이 안전장비안챙기긴 한전감독이랑 작업자랑 싸우는1순위가 안전장구랑 안전수칙 지켜라고 작업자는 불편하다 ㄱㅊ다
707,707,보다보니 자재송달이 넘 위험한데 지자체에서 헬기라도 지원해야 삐르고 안전하지 않을까요? 헬기지원 비용문제가 아닌것같음 너무 위험천만 순간실수 바로죽음이라서요 ㅡㅡ
708,708,영상으로 보는데도 그냥 아찔하네요. 사무실 의자에서 보는 동안에도 조마조마... 아이구야...
709,709,옛날   82년도 에 알바로위에서 송전탑 전선위에서작업을 했던 기억이 아직남아있지요~!내나이 21살! 야간대학에다닐땐데 그때는 사람들이모두 고생들을 해서  살아와서그런지 아무  겁도 없었지요 ~! 지상에서 작업하면 하루8000원 !고공작업은 만오천원 이었읍니다~내나이  오십칠세인데우리 선배세대들은 진짜고생많이 했습니다!선배 세대님들께 다시한번경의를 표합니다~!
710,710,지금은  장비도  좋아졋고  일당도  생각보다  쎕니다  일이야  위험하고  힘든건 사실이지만^^   저도  올해로  철탑한지  25년 됩니다
711,711, @김종호  늘 안전에 안전~!조심하셔셔  작업하시길 바랍니다~!하나님께서  지킴심과 은총이늘 함께  하시길 빕니다~!
712,712,놀랍습니다..........이분들 받으셔야 할  연봉은 3억 이상이라고 생각하면서 봤습니다
713,713,직업적 사명감없인 아무나 할수없는 대단하시고 대단하신분들입니다 돈을 아무리 많이 준다해도저흰 못하는일이런 보이지않는곳에서 열심히 일하시는분들이 있기에 안전하게 전기를쓸수있네요 감사하고 감사합니다보는내내 아찔하고 제 심장이 다떨리네요 항상 안전유의 하시길 빌께요가족들 부양하느라 정말 고생 많으세요
714,714,진짜 극한직업은 극한직업 촬영팀이었다..
715,715,추락 or 감전 이라는 둘다 바로 즉사할 수 있는 위험이 따르기 때문에 진짜 극한직업임..
716,716,너무 무섭다ㅠㅠㅠㅠㅠㅠ
717,717,저런 목숨을 내놓고 하는 일은 엄청 고수익으로 대우해야 할텐데... 이나라는고급 전문 인력관리를 제대로 못하는게 무식한 그 자체다
718,718,"그러게요,.이 망할놈의 개한민국은 펜대든놈 위주죠..."
719,719,쌉인정. 독일이나 호주같은 엔지니어 대우가이뤄지려면 통일이 더빠를듯?
720,720,조선시대부터 내려온 역사와전통을 자랑하는 기술자 개무시 문화
721,721,무식해서 공부가 최고인즐암
722,722,이분들 고수익임
723,723,걍 닥치고 능력있고 생산성 높으면 돈 많이 주고 대우해줘야됨 이분들이 이케이스
724,724,상식적으로 돈조금주는데 저길 올라가겠음? 대충 백이상은 받을듯
725,725, @Ouo eunj_  백기준이면뒤져도안하지 경제상식터졌노
726,726, @Ouo eunj_  병 신아 어디가서 설거지만 해도 백은 번다
727,727, @일반인  하루에 백이라고
728,728,예전엔 자격증 없어도 작업 했었는데!철탑
729,729,송전탑마다 위에서 내려오는 긴 줄 고리를 만들어놓고 등에 걸면 최소한의 안전장치가 될텐데 좀 아쉽네요
730,730,저는 백만금 주어도 못하겠어요. 작업자분들 고생많아요. 항상 안전하시고 건강ㅎㅏ세요
731,731,와 난 저거 죽어도 못하겠다. 대단하신 분들이다....와.....
732,732,철탑오르는것부터 목숨을 걸고하네요;;;좀더 안전장치가 필요합니다!!
733,733,11:03 아니 이 부분은 진짜 어떡하나요.. 안전띠도 풀고 넘어가는데 보는데 바로 손에 땀이 차네요
734,734,와..
735,735,로봇 같은걸로 대체 되면 좋을것 같지만 지금 당장은 어려울것 같네요
736,736,그저 감사와 존경을...
737,737,말이 안나오네요ㆍ존경해요
738,738,"이런분들이 계급이 있다면 듀크,공작, 로드님들 이시다......  내 생전 실제로 진짜 저기 매달려있는 광경을 본적이 없는데.. 정말 저렇게 매달려 벌레처럼 수작업을...할 줄 이야.. ft. 극한직업 쵝오!  근데 이런식으로 보통 사회의 모든 직업에 관해서도 프로가  있으면 무척 유익하겠다요~"
739,739,"송전철탑 전공 정말 고생 많이 합니다 철탑현장 345KV 765KV 에 3번이나 근무를 했는데 저 산길을 가는데 차가 굴러떨어질까싶어서 그게 겁이 나더군요 전공들 주소를 보면 한마을에 삼촌 동생 동생친구 이런식으로 많습니다 아침먹고 점심 도시락 싸서 올라가서 퇴근할때 내려오니 참 힘든 직업입니다 비, 눈, 바람불면 작업을 못해서 실제로 일당은 쎄도 큰돈은 못만지고 노총각들이 상당히 많습니다 순박하고 그렇습니다 전공들이"
740,740,이런거야 말로 진짜 기계화가 필요하다..드론같은...
741,741,근데 아무리 드론쓴다고 해도 사람눈보다 정확하지는 못할듯.
742,742,어허.... 실업자 생각도 해주셨습합니다!
743,743, @서울과기대 96학번  하지만 너무나 위험 합니다.ㅜ
744,744, @말벌의하루  눈으로 보는 점검은 다 드론으로함 눈보다 카메라가 더 잘보이지
745,745,실업자될 사람 재정상태가 더 위험함
746,746,저분들은 두번죽는다고 하드라... 34만볼트에 감전되서 죽고 떨어져서 죽고.... 참 대단하시다.
747,747,차라리 감전돼서 즉사하는게 나을거같네요... 목숨 겨우 붙어서 떨어지는 동안 땅 가까워지는거 다 목격하느니...
748,748,수고들 많으십니다.
749,749,"그저 고개숙이고, 참으로 감사합니다. 당신의 수고에 내가 이렇게 전기를 쓰고 있군요. 늘  조심하세요"
750,750,전 이거하시다가 감전되서 추락해서 돌아가신거 앞에서 목격해서 너무 무섭고 걱정되네요 다들 힘내세요ㅠㅠ
751,751,자랑스럽고 감사 거듭감사 드립니다.
752,752,아... 저분들도 첫작업할때가 있었을텐데 그땐경험도 없이 혼자 매달려서 할건데 어찌하신겁니까 와..
753,753,액션캠이라서 더 그런건가.. 보는데도 경련오네요.. ㄷㄷㄷ
754,754,와 시벌 진짜 대단한 분들이시다존경합니다.
755,755,저분들 진짜 존경스러운 분들임 난 저거10억을 준다해도 못한다
756,756,감사할 뿐 입니다.대단들 하십니다.감사합니다.
757,757,영상으로 보고있는데도 지릴것 같은데요.
758,758,특고압 감전시 최소사망인데 정말 감사한분들..
759,759,와 진짜 개무섭다...
760,760,15~20kg 이라니... 라떼는말이야. 콤프메고 다녔어. 마지막 현장이 울진태백간 765였지.전공여러분 안전기원 합니다.
761,761,저걸 전동장치를 이용해서 움직이는 장비가 개발되야지 너무 고생하시네....
762,762,와.... 감사합니다 ...
763,763,떨어진자는 말이없다 ㄷㄷㄷㄷ
764,764,대단하네요
765,765,안전장비도 없이 암벽등반이네요...ㅠㅠ
766,766,저거 하시다 감전되서 오신분 봣는데 엄청 위험한거엿군요
767,767,한달에 얼마를 줘도 안아까운 분들이다..사람이 할 수밖에 없는 일들...
768,768,생명수당? 그런거 챙겨준다해도 애초에 고압선 자체가 건강에 안좋은데..에효
769,769,감사합니다.전기 아껴 쓰도록..노력 하겠습니다..🙏
770,770,박사학위를 5개 따는 건 해도 이건 못하겠다정말 감사합니다👍👍👍
771,771,헐‥처음에일배우실때가 제일어려우실것 같았는데 어떠케배우셨는지 그게제일궁금합니다 ㅎㅎ특히젊은분들은 마니기피하지요‥이영상보고나서 느낀게너무 대단하시고 존경스럽네요꾸ㅡ벅ㅎㅎ날씨 조은날작업하시고  건강하시고ㅡ육지에사는모든ㅅㄹ들불평불만 해서는안된다는걸 마니깨닫게되는 영상 입니다???
772,772,올라갈때 안전장비가 없으면 어떡해 ㅆㅂ.. 진짜 미쳤어..
773,773,어릴때 철탑에서 순래잡기  많이 했었는데   지금생각하면 위험한 놀이ㅠㅠ
774,774,참 존경 ㅎ
775,775,"한전이 공기업이어도 일선 현장 노동자에 대한 안전 대우가 이 수준인데, 민영화 했다고 생각하면... 끔찍합니다."
776,776,한전은 민영화 되었어요. 한전 주식 살수 있어요.
777,777, @Yong JJ  아닐텐데....공기업도 주식 발행해요
778,778,시장형 공기업이지 민영화가 아닙니다.
779,779,진심으로 존경합니다
780,780,와~나같음 송전탑에 올라가는 자체도 못할거같음진짜 안전장치 하나없이 그냥 볼트같은 손잡이에 의지해 저렇게 높은곳을 오른다니~영상 보는것만으로도 후덜덜하다
781,781,전기 아껴써야겠네요...감사합니다.
782,782,난 진짜 돈을 얼마를 준다해도 한 번 올라가보곤 못하겠다하고 도망갈듯... 대단하시다
783,783,진짜멋이따.....
784,784,미쳤다...저길 어떻게 올라가냐...
785,785,지중에 매설하면 점검도 얼마나 편할까..
786,786,저런 위험한일을 외주주는건 진짜 지양해야한다 정식 채용하고 위험에 맞는 급여와 복지를 제공해야함...
787,787,내가 볼때 연봉 최소 2억에 플러스 알파여야 된다고 생각합니다..  저 직업은 보험도 안들어 줄 것 같아서 말이죠..!
788,788,우와 죽여주네최고입니다감사합니다
789,789,ㅋㅋㅋㅋㅋㅋ연봉 10억줘도 나는 못한다 대단하다 진짜
790,790,와 진짜 레전드네 ㅋㅋㅋ 와 어케 전선위를 걷지 하늘나는 기분이겠네 개무섭가
791,791,와 개 무섭다 .. 대단하신분들 한발도 못움직이겠고만 와
792,792,안전대책좀 세우면 안되나... 너무도 너무도 위험해 보입니다. 어차피 한전이 하청을 줄텐데 너무 무책임하네요. 더도말고 기둥에 안전고리만 채워도 최악의 낙하는 예방할거같은데 그냥 다들 곡예사같습니다. 무언가 대책이 필요할 것 같네요. 안전봉 설치가 시급해보입니다.
793,793,솔직히 한전 사무직 빙시들 월급 줄이고 이분들 월급 훨 더줘야하는데 월 800 1000은줘야하는거아니냐
794,794, @vtaper  이미 그이상 받고 일하지 몸쓰는일은 월급 적을거라는 편견보소
795,795, @참이슬 친구 아버지가 저일 합니다. 일당 20에서 30만원 정도받는다고 들었는데 한달 30일 전부 일하는것도 아니고 월천  못 법니다. 어디서 월1000넘게 번다고 들었나요?
796,796,"심심풀이땅콩용 남 수준도 보이는게, 저 힘드신 분들의 권익을 챙기자는 생각은 좋으나, 역으로 사무직은 병신으로 치부하는 마인드가 참 하찮네요. 그런 식으로 말씀하시면 저런 분들을 하찮게 여기는 인간들이랑 님도 다를 바가 없게 되는겁니다."
797,797, @PROCRASTINATE  흠...한전사무직만 빙신취급했는데... 모든 사무직이 아니고한전사무직 인턴으로 3개월 했을때 진짜 개빙시들 같아서 한말입니다. 저일 하시는 분들이 3배는 돈 더받아야 한다고 생각합니다. 제 생각은 바뀌지 않습니다.
798,798,"심심풀이땅콩용 공기업 문화가 도긴개긴이겠지만, 님이 그렇게 느끼셨다고해서 함부로 한전 사무직 전체를 싸잡아 병신취급하는 발언은 위험합니다. 저 고된 일하시는 분들 중에서도 말안통하고 사람 짜증나게하는 사람이 분명 있을 겁니다. 사무직에서도 당연히 한심한 인간들이 많은 것도 사실이죠. 그냥 각자 다른 영역이고, 서로의 영역을 존중해주어야지, 누구를 더 대우해주길 원하면서 다른 누구를 비하하는 사상은 중립적이지도 못하고 올바르지 못한 사상입니다."
799,799, @안수찬  ㄱㅋㄱㅋㄱ 절대아님학창시절때 열공하면 월 최대 300학창시절때 놀면 원자력같은데만 들가도 몸 조금쓰지만 월 250임 ㅋㅋㅋㅋ 월최대300(성과금이 존나많긴하지만 야근존나함 그래서 일하기 싫음 내가 개 좆같은 개한민국 시바 윗대가리들은 배운것도 나랑 비슷하믄 비슷한디 나이처먹고 짬많다고 ㅈㄹ하는거 스트레스개받음)즉 야근한만큼 돈 주고 하니까 월급은 비슷함원자력도 우리한전처럼 금요일 일찍퇴근함그럼 뭐로 인생이 다르냐??? 부모님자산 or 개인사업해서 대박이것뿐임 님 몇살이심? 나이 어리면 아직 이런거 모를테고 ...
800,800, @PROCRASTINATE  네... 맞는말씀이십니다. 하지만 너무 제 회사윗새끼들이 싫네요 인성이.... 제 형은 원자력 다니는데 원자력에서 이번에 사무직 빠져서 일 편하게 한다하는데다들 사람들도 친해서 족구도 점심에 하고 ㅜ 저는 개 잣같네요 공부해서 들어갔는데
801,801,"심심풀이땅콩용 네 사실 무슨 말씀인지는 압니다. 사실 저도 짬질이나 하고 업무, 책임 아랫 것에게 죄다 전가하고 니 알아서 배우고 알아서 해나가라는 식의 일부 공기업 마인드가 그냥 혐오스럽습니다. 주위에도 공기업 다니는 사람들보면 다 사정이 다르더라구요... 너무 스트레스 받으셔서 이직 준비하시는 분들도 상당히 많더군요. 참 기업문화가 바뀌어야되는데 공기업 특성상 바뀔리가 없겠죠ㅎㅎ 그런 인간들 월급 삭감하는 건 솔직히 존나게 동의합니다..."
802,802,"라면 자본주의 사회에서는 자본가 이외에는 모두 자본주의식 노예와도 같습니다. 자본가가 아닌 자들 중 극소수 상위1%의 브레인들이 전문직을 통해 자본가의 돈을 상당수 끌어모으는 구조이고, 혹은 고위관료가 되거나 하는 식이죠. 그럼 나머지 공부쟁이들은 기껏해야 대기업 입사가 가장 큰 산인데, 대기업이라고 해봤자 결국 자본가의 노예밖에 안되는 구조입니다. 삼전, 현차같은 거물급 대기업을 제외하고는 솔직히 부자라고 칭하기 부끄러울만큼의 연봉을 받고 살아가며, 그 정도 연봉으로는 부자 축에도 못낍니다. 그래 벌어봐야 강남에 집 1채도 못사고 죽습니다. 연봉 4천이 큰 금액이신가요? 9급 공무원 연봉이 3-4천 찍히는데 연봉 4천해서 모아봐야 강남은 커녕 저 북쪽에 도봉구 집도 못삽니다. 우리가 하는 공부의 의미는, 떵떵거리면서 살 수 있게 해주는 키가 아니라 적어도 사람답게 살 수 있기 위한 노력이라고 보는게 더 가까울 것 같습니다. 돈 벌어서 부자되고 싶다면, 자식교육에 투자하는 것보다 부동산, 주식등에 투자하거나 사업에 투자하는게 더 맞는 수순입니다. 자식을 교육시키는 것은, 자식이 서민답게 살 수 있도록 자립시켜준다는 의의가 있고, 자식이 고등교육을 받은 교양있는 인간으로써 살아갈 수 있도록 부모가 노력한다는 데 의의가 있습니다. 부자되려고 공부한다라... 그렇다면 자식의 머리가 타고나서 일류 변호사•회계사 등의 레벨이 되어야겠지요."
803,803,정말 대단하신분들.박수를 쳐 드립니다.어우.. 너무 무서운곳에서 일하시는데...존경스럽습니다..
804,804,"오금 저리는 높이. 345kV 활선. 사선이라도 충전 전류의한 감전 항상 가능, ㄷㄷㄷ"
805,805,안전문제가 시급합니다… 미국 근로자분들이 우리나라 작업 환경을 보고 돈을 아무리 많이줘도 안한다고 합니다..
806,806,와 이건 너무위험한데 이게 최선인가 ㅋㅋㅋㅋㅋㅋㅋㅋ
807,807,무한한 경의를  표합니다
